{
  "$schema": "https://semantic-code-review.dev/schemas/v0.1/requirement.schema.json",
  "id": "skill-user-manual",
  "title": "Explain the complete skill workflow",
  "summary": "A user unfamiliar with the tool can understand setup, initialization, staged implementation, review feedback, publication, landing, archival, and the files and commits created in the repository.",
  "source": {
    "kind": "local",
    "reference": "user-request-2026-07-31"
  },
  "acceptanceCriteria": [
    {
      "id": "explain-initialization",
      "text": "The manual explains how to initialize a review and exactly what initialization adds or changes locally."
    },
    {
      "id": "explain-implementation",
      "text": "The manual explains beginning, recording, committing, finalizing, validating, and replaying semantic stages."
    },
    {
      "id": "explain-review",
      "text": "The manual explains running the UI, submitting feedback, applying revisions, and approving resolutions."
    },
    {
      "id": "explain-landing",
      "text": "The manual explains publication, PR-ready branch creation, merge expectations, and archival."
    },
    {
      "id": "explain-repository-effects",
      "text": "The manual clearly distinguishes ignored working state, stage commits, metadata commits, feedback state, branches, and archived artifacts."
    }
  ]
}
