{
  "$schema": "https://semantic-code-review.dev/schemas/v0.1/requirement.schema.json",
  "id": "review-documentation",
  "title": "Explain review workflow to users",
  "summary": "An unfamiliar reviewer can understand and use the local semantic review workflow, while future Git topology options remain visible.",
  "source": {
    "kind": "local",
    "reference": "user-request-2026-07-30"
  },
  "acceptanceCriteria": [
    {
      "id": "note-stage-branches",
      "text": "The roadmap identifies branch-per-stage stacked diffs as a potential future improvement without changing the current v0.1 model."
    },
    {
      "id": "manual-start",
      "text": "The manual explains how to start and open the local review app."
    },
    {
      "id": "manual-review",
      "text": "The manual explains stages, requirements, reasoning, validation, and diffs in user terms."
    },
    {
      "id": "manual-feedback",
      "text": "The manual explains how to create, submit, and review feedback across stages."
    },
    {
      "id": "manual-approval",
      "text": "The manual explains resolution approval and whole-stack approval."
    }
  ]
}
